{
  "schema_version": "0.2.0",
  "as_of_date": "2026-09-06",
  "record_count": 78,
  "records": [
    {
      "id": "ae-customs",
      "title": "UAE Customs",
      "authority": "Federal Authority for Identity, Citizenship, Customs and Port Security",
      "url": "https://icp.gov.ae/en/about-icp/uae-customs-en/",
      "license": null,
      "license_url": null,
      "reuse_conditions": "Factual metadata was transcribed and normalized; consult the source terms before reusing source content.",
      "retrieved_date": "2026-09-06",
      "last_verified": "2026-09-06",
      "normalization": "Authority responsibility mapped to a controlled customs-authority type.",
      "dataset_fields": [
        "authority_type",
        "country_code",
        "name",
        "website"
      ],
      "update_frequency": "annual"
    },
    {
      "id": "ae-customs-tariff",
      "title": "Central Customs Tariff System",
      "authority": "Federal Authority for Identity, Citizenship, Customs and Port Security",
      "url": "https://icp.gov.ae/en/central-customs-tariff-system/",
      "license": null,
      "license_url": null,
      "reuse_conditions": "Factual metadata was transcribed and normalized; consult the source terms before reusing source content.",
      "retrieved_date": "2026-09-06",
      "last_verified": "2026-09-06",
      "normalization": "Portal purpose summarized into controlled portal type and topic values.",
      "dataset_fields": [
        "country_code",
        "name",
        "portal_type",
        "topics",
        "website"
      ],
      "update_frequency": "annual"
    },
    {
      "id": "ae-export-development",
      "title": "UAE Export Development",
      "authority": "United Arab Emirates Ministry of Economy and Tourism",
      "url": "https://www.moet.gov.ae/en/web/guest/uae-export-development",
      "license": null,
      "license_url": null,
      "reuse_conditions": "Factual metadata was transcribed and normalized; consult the source terms before reusing source content.",
      "retrieved_date": "2026-09-06",
      "last_verified": "2026-09-06",
      "normalization": "Organization responsibilities summarized into controlled agency and service values.",
      "dataset_fields": [
        "agency_type",
        "country_code",
        "name",
        "services",
        "website"
      ],
      "update_frequency": "annual"
    },
    {
      "id": "afcfta-status",
      "title": "AfCFTA ratification status",
      "authority": "Trade Law Centre (tralac)",
      "url": "https://www.tralac.org/afcfta-resources.html",
      "license": null,
      "license_url": null,
      "reuse_conditions": "Factual metadata was transcribed and normalized; consult the source terms before reusing source content.",
      "retrieved_date": "2026-09-06",
      "last_verified": "2026-09-06",
      "normalization": "Country names mapped to ISO alpha-2 codes; deposited parties and signatories represented as separate statuses.",
      "dataset_fields": [
        "members",
        "status"
      ],
      "update_frequency": "quarterly"
    },
    {
      "id": "african-union-members",
      "title": "African Union member states",
      "authority": "African Union",
      "url": "https://au.int/en/member_states/countryprofiles2",
      "license": null,
      "license_url": null,
      "reuse_conditions": "Factual metadata was transcribed and normalized; consult the source terms before reusing source content.",
      "retrieved_date": "2026-09-06",
      "last_verified": "2026-09-06",
      "normalization": "Member state names mapped to ISO alpha-2 codes.",
      "dataset_fields": [
        "members"
      ],
      "update_frequency": "before-release"
    },
    {
      "id": "asean-members",
      "title": "Timor-Leste integration as the 11th ASEAN member",
      "authority": "Association of Southeast Asian Nations",
      "url": "https://asean.org/timor-leste-advances-into-a-new-era-of-integration-with-asean/",
      "license": null,
      "license_url": null,
      "reuse_conditions": "Factual metadata was transcribed and normalized; consult the source terms before reusing source content.",
      "retrieved_date": "2026-09-06",
      "last_verified": "2026-09-06",
      "normalization": "Member names mapped to ISO alpha-2 codes.",
      "dataset_fields": [
        "members"
      ],
      "update_frequency": "before-release"
    },
    {
      "id": "au-abf",
      "title": "Who we are",
      "authority": "Australian Border Force",
      "url": "https://www.abf.gov.au/about-us/who-we-are",
      "license": null,
      "license_url": null,
      "reuse_conditions": "Factual metadata was transcribed and normalized; consult the source terms before reusing source content.",
      "retrieved_date": "2026-09-06",
      "last_verified": "2026-09-06",
      "normalization": "Authority responsibility mapped to a controlled customs-authority type.",
      "dataset_fields": [
        "authority_type",
        "country_code",
        "name",
        "website"
      ],
      "update_frequency": "annual"
    },
    {
      "id": "au-austrade",
      "title": "About Austrade",
      "authority": "Australian Trade and Investment Commission",
      "url": "https://www.austrade.gov.au/en/about-austrade",
      "license": null,
      "license_url": null,
      "reuse_conditions": "Factual metadata was transcribed and normalized; consult the source terms before reusing source content.",
      "retrieved_date": "2026-09-06",
      "last_verified": "2026-09-06",
      "normalization": "Organization responsibilities summarized into controlled agency and service values.",
      "dataset_fields": [
        "agency_type",
        "country_code",
        "name",
        "services",
        "website"
      ],
      "update_frequency": "annual"
    },
    {
      "id": "au-export-guidance",
      "title": "Exporting and your business",
      "authority": "Australian Government",
      "url": "https://business.gov.au/products-and-services/exporting/exporting-and-your-business",
      "license": null,
      "license_url": null,
      "reuse_conditions": "Factual metadata was transcribed and normalized; consult the source terms before reusing source content.",
      "retrieved_date": "2026-09-06",
      "last_verified": "2026-09-06",
      "normalization": "Portal purpose summarized into controlled portal type and topic values.",
      "dataset_fields": [
        "country_code",
        "name",
        "portal_type",
        "topics",
        "website"
      ],
      "update_frequency": "annual"
    },
    {
      "id": "be-customs",
      "title": "Customs and Excise",
      "authority": "Belgian Federal Public Service Finance",
      "url": "https://finance.belgium.be/en/customs_excises",
      "license": null,
      "license_url": null,
      "reuse_conditions": "Factual metadata was transcribed and normalized; consult the source terms before reusing source content.",
      "retrieved_date": "2026-09-06",
      "last_verified": "2026-09-06",
      "normalization": "Authority responsibility mapped to a controlled customs-authority type.",
      "dataset_fields": [
        "authority_type",
        "country_code",
        "name",
        "website"
      ],
      "update_frequency": "annual"
    },
    {
      "id": "be-foreign-trade-agency",
      "title": "Belgian Foreign Trade Agency",
      "authority": "Belgian Foreign Trade Agency",
      "url": "https://abh-ace.be/en",
      "license": null,
      "license_url": null,
      "reuse_conditions": "Factual metadata was transcribed and normalized; consult the source terms before reusing source content.",
      "retrieved_date": "2026-09-06",
      "last_verified": "2026-09-06",
      "normalization": "Official portal and organization responsibilities summarized into controlled portal, topic, agency, and service values.",
      "dataset_fields": [
        "agency_type",
        "country_code",
        "name",
        "portal_type",
        "services",
        "topics",
        "website"
      ],
      "update_frequency": "annual"
    },
    {
      "id": "br-apex",
      "title": "ApexBrasil",
      "authority": "Brazilian Trade and Investment Promotion Agency",
      "url": "https://apexbrasil.com.br/en",
      "license": null,
      "license_url": null,
      "reuse_conditions": "Factual metadata was transcribed and normalized; consult the source terms before reusing source content.",
      "retrieved_date": "2026-09-06",
      "last_verified": "2026-09-06",
      "normalization": "Organization responsibilities summarized into controlled agency and service values.",
      "dataset_fields": [
        "agency_type",
        "country_code",
        "name",
        "services",
        "website"
      ],
      "update_frequency": "annual"
    },
    {
      "id": "br-receita-customs",
      "title": "Customs and foreign trade",
      "authority": "Receita Federal do Brasil",
      "url": "https://www.gov.br/receitafederal/pt-br/assuntos/aduana-e-comercio-exterior",
      "license": null,
      "license_url": null,
      "reuse_conditions": "Factual metadata was transcribed and normalized; consult the source terms before reusing source content.",
      "retrieved_date": "2026-09-06",
      "last_verified": "2026-09-06",
      "normalization": "Authority responsibility mapped to a controlled customs-authority type.",
      "dataset_fields": [
        "authority_type",
        "country_code",
        "name",
        "website"
      ],
      "update_frequency": "annual"
    },
    {
      "id": "br-siscomex",
      "title": "Siscomex Portal",
      "authority": "Brazilian Federal Government",
      "url": "https://www.gov.br/siscomex/pt-br/siscomex/",
      "license": null,
      "license_url": null,
      "reuse_conditions": "Factual metadata was transcribed and normalized; consult the source terms before reusing source content.",
      "retrieved_date": "2026-09-06",